run_id	time	backend	status	score	gen_tok_s	prompt_tok_s	ttft_ms	load_s	min_free_gb	swap_delta_gb	description
20260402T195218Z-llama-cpp-baseline-context-2048	2026-04-02T19:52:18.665976+00:00	llama.cpp	reject	0.0000	0.0000	0.0000	0.0000	0.0000	1.7944	0.0000	llama.cpp baseline context 2048
20260402T195359Z-llama-cpp-baseline-context-2048	2026-04-02T19:53:59.051944+00:00	llama.cpp	reject	0.0000	0.0000	0.0000	0.0000	0.0000	0.9680	0.9737	llama.cpp baseline context 2048
20260402T195425Z-hypura-baseline-context-2048	2026-04-02T19:54:25.146505+00:00	hypura	reject	0.0000	0.0000	0.0000	0.0000	0.0000	2.3515	0.0000	hypura baseline context 2048
20260402T195531Z-llama-cpp-low-memory-verificatio	2026-04-02T19:55:31.506959+00:00	llama.cpp	crash	0.0000	0.0000	0.0000	0.0000	0.0000	17.9218	0.0000	llama.cpp low-memory verification
20260402T195604Z-llama-cpp-low-memory-verificatio	2026-04-02T19:56:04.576005+00:00	llama.cpp	reject	0.0000	0.0000	0.0000	0.0000	0.0000	4.1539	0.3830	llama.cpp low-memory verification
20260402T195632Z-llama-cpp-low-memory-verificatio	2026-04-02T19:56:32.363217+00:00	llama.cpp	reject	0.0000	0.0000	0.0000	0.0000	0.0000	4.0013	0.8167	llama.cpp low-memory verification
20260402T195652Z-llama-cpp-low-memory-verificatio	2026-04-02T19:56:52.928548+00:00	llama.cpp	reject	0.0000	0.0000	0.0000	0.0000	0.0000	4.1558	0.7412	llama.cpp low-memory verification
20260402T195727Z-hypura-low-memory-verification	2026-04-02T19:57:27.856931+00:00	hypura	reject	0.0000	0.0000	0.0000	0.0000	0.0000	3.0605	0.0000	hypura low-memory verification
20260402T195916Z-hypura-smoke-verification	2026-04-02T19:59:16.296105+00:00	hypura	reject	0.0000	0.0000	0.0000	0.0000	0.0000	2.5927	0.0000	hypura smoke verification
20260402T200243Z-llama-cpp-smoke-verification	2026-04-02T20:02:43.462017+00:00	llama.cpp	reject	0.0000	0.0000	0.0000	0.0000	0.0000	4.1508	0.6048	llama.cpp smoke verification
20260402T200315Z-llama-cpp-smoke-verification	2026-04-02T20:03:15.069988+00:00	llama.cpp	keep	28.5000	28.5000	12.4000	35.0877	32.2940	4.1492	0.6982	llama.cpp smoke verification
20260402T202238Z-hypura-server-smoke	2026-04-02T20:22:38.141317+00:00	hypura	crash	0.0000	0.0000	0.0000	0.0000	0.0000	14.9775	0.0000	hypura server smoke
20260402T202255Z-hypura-server-smoke	2026-04-02T20:22:55.325536+00:00	hypura	reject	0.0000	0.0000	0.0000	0.0000	0.0000	1.7706	0.0000	hypura server smoke
20260402T203636Z-hypura-server-smoke	2026-04-02T20:36:36.951472+00:00	hypura	reject	0.0000	0.0000	0.0000	0.0000	0.0000	1.6889	0.0000	hypura server smoke
20260402T203711Z-hypura-server-bench-smoke	2026-04-02T20:37:11.928283+00:00	hypura	keep	52.0649	52.0649	21468.0347	22.3743	0.9672	1.6801	0.0000	hypura server bench smoke
20260402T210157Z-hypura-strict-reserve-probe	2026-04-02T21:01:57.778310+00:00	hypura	discard	45.4109	45.4109	62.9614	1102.0478	7.8299	8.7121	0.0000	hypura strict reserve probe
20260402T210451Z-hypura-strict-reserve-probe	2026-04-02T21:04:51.364067+00:00	hypura	keep	54.5304	54.5304	43.4264	1584.2064	4.3624	9.6083	0.0000	hypura strict reserve probe
20260402T210714Z-hypura-reserve-12gb	2026-04-02T21:07:14.389361+00:00	hypura	discard	43.3657	43.3657	67.7428	1026.8564	3.5900	9.3560	0.0000	hypura reserve 12gb
20260402T210733Z-hypura-reserve-10gb	2026-04-02T21:07:33.140531+00:00	hypura	discard	45.4310	45.4310	62.1547	1116.0556	2.5961	9.1049	0.0000	hypura reserve 10gb
20260402T210750Z-hypura-reserve-8gb	2026-04-02T21:07:50.757576+00:00	hypura	discard	45.0061	45.0061	68.0243	1021.8624	1.4707	10.5144	0.0000	hypura reserve 8gb
20260402T210822Z-hypura-strict-reserve-stable	2026-04-02T21:08:22.510131+00:00	hypura	discard	45.4456	45.4456	68.0898	1020.4392	2.5564	9.1457	0.0000	hypura strict reserve stable
20260402T210909Z-hypura-context-3072-strict	2026-04-02T21:09:09.684948+00:00	hypura	discard	45.1838	45.1838	69.4261	1001.5906	1.6984	10.5320	0.0000	hypura context 3072 strict
20260402T210924Z-hypura-context-4096-strict	2026-04-02T21:09:24.922565+00:00	hypura	discard	52.6100	52.6100	33.8535	2027.6602	2.4290	9.3346	0.0000	hypura context 4096 strict
20260402T210949Z-hypura-context-4096-stable	2026-04-02T21:09:49.023895+00:00	hypura	keep	55.4370	55.4370	68.1921	1015.1848	1.5299	9.5701	0.0000	hypura context 4096 stable
20260402T211322Z-hypura-4096-t8	2026-04-02T21:13:22.270579+00:00	hypura	discard	51.9571	51.9571	47.6667	1445.8195	1.7434	9.9854	0.0000	hypura 4096 t8
20260402T211338Z-hypura-4096-t12	2026-04-02T21:13:38.525592+00:00	hypura	discard	42.6224	42.6224	42.5522	1621.4987	1.9019	9.4965	0.0000	hypura 4096 t12
20260402T211356Z-hypura-4096-t14	2026-04-02T21:13:56.365579+00:00	hypura	discard	5.3325	5.3325	65.6595	1223.1745	2.0948	9.2226	0.0000	hypura 4096 t14
20260402T211451Z-hypura-4096-b256	2026-04-02T21:14:51.269826+00:00	hypura	discard	13.4846	13.4846	49.9672	1435.0505	1.5513	10.8367	0.0000	hypura 4096 b256
20260402T211511Z-hypura-4096-b1024	2026-04-02T21:15:11.717328+00:00	hypura	discard	13.4783	13.4783	62.3756	1164.3638	1.7555	8.9585	0.0000	hypura 4096 b1024
20260402T211549Z-hypura-context-4096-stable	2026-04-02T21:15:49.510607+00:00	hypura	discard	55.0250	55.0250	68.0483	1017.3382	1.9097	9.6685	0.0000	hypura context 4096 stable
20260402T211755Z-hypura-context-4096-stable-expli	2026-04-02T21:17:55.140594+00:00	hypura	discard	55.3691	55.3691	67.4172	1026.6761	2.2110	9.3076	0.0000	hypura context 4096 stable explicit
20260402T212109Z-hypura-4096-threads-batch-14	2026-04-02T21:21:09.684155+00:00	hypura	keep	56.6721	56.6721	61.0621	1131.2664	2.4459	9.2393	0.0000	hypura 4096 threads-batch 14
20260402T212130Z-hypura-4096-ubatch-256	2026-04-02T21:21:30.078732+00:00	hypura	keep	56.9525	56.9525	64.7960	1067.0067	2.3770	9.3311	0.0003	hypura 4096 ubatch 256
20260402T212254Z-hypura-4096-combo-prompt	2026-04-02T21:22:54.080594+00:00	hypura	discard	57.5573	57.5573	67.4265	1025.8794	1.9589	10.6233	0.0000	hypura 4096 combo prompt
20260402T212311Z-hypura-4096-combo-prompt-stable	2026-04-02T21:23:11.387229+00:00	hypura	keep	57.0126	57.0126	67.4410	1025.7408	1.9716	9.3331	0.0000	hypura 4096 combo prompt stable
20260402T212514Z-hypura-4096-combo-tb12	2026-04-02T21:25:14.295440+00:00	hypura	discard	42.8788	42.8788	55.3923	1250.9282	3.7522	8.7630	0.0000	hypura 4096 combo tb12
20260402T212538Z-hypura-4096-combo-tb16	2026-04-02T21:25:38.454389+00:00	hypura	discard	50.7305	50.7305	8.5470	7975.7099	3.7010	8.4569	0.0000	hypura 4096 combo tb16
20260402T212639Z-hypura-4096-combo-u128	2026-04-02T21:26:39.569881+00:00	hypura	discard	55.1522	55.1522	57.6443	1197.7798	3.5252	8.5434	0.0000	hypura 4096 combo u128
20260402T214221Z-hypura-4096-t9-probe	2026-04-02T21:42:21.548683+00:00	hypura	discard	53.5338	53.5338	24.0279	2848.7246	9.3809	7.7895	0.0000	hypura 4096 t9 probe
20260402T214302Z-hypura-4096-t11-probe	2026-04-02T21:43:02.227504+00:00	hypura	discard	46.4282	46.4282	57.1948	1210.4571	4.1317	8.0991	0.0000	hypura 4096 t11 probe
20260402T214323Z-hypura-4096-tb13-probe	2026-04-02T21:43:23.475062+00:00	hypura	discard	57.9394	57.9394	60.1696	1147.3983	3.3927	8.0315	0.0000	hypura 4096 tb13 probe
20260402T214341Z-hypura-4096-tb15-probe	2026-04-02T21:43:41.952523+00:00	hypura	discard	57.4765	57.4765	13.4037	5090.6165	3.1838	8.0619	0.0000	hypura 4096 tb15 probe
20260402T214418Z-hypura-4096-u384-probe	2026-04-02T21:44:18.463914+00:00	hypura	discard	52.7861	52.7861	41.2435	1667.6876	3.3836	7.9539	0.0000	hypura 4096 u384 probe
20260402T214448Z-hypura-4096-tb13-stable	2026-04-02T21:44:48.040511+00:00	hypura	discard	53.5701	53.5701	62.4418	1107.6804	3.6684	7.8681	0.0000	hypura 4096 tb13 stable
20260402T214919Z-hypura-4096-combo-prompt-stable	2026-04-02T21:49:19.120627+00:00	hypura	discard	44.3787	44.3787	26.7853	2561.2417	5.3618	7.9869	0.0000	hypura 4096 combo prompt stable
20260402T214949Z-hypura-4096-combo-prompt-stable	2026-04-02T21:49:49.418850+00:00	hypura	discard	34.6498	34.6498	17.6610	3879.1528	3.5001	7.7570	0.0000	hypura 4096 combo prompt stable
20260402T215019Z-hypura-4096-combo-prompt-stable	2026-04-02T21:50:19.977734+00:00	hypura	discard	30.2683	30.2683	10.6544	6415.3675	4.2611	7.4655	0.0000	hypura 4096 combo prompt stable
20260402T215101Z-hypura-4096-combo-prompt-stable	2026-04-02T21:51:01.067563+00:00	hypura	discard	25.3719	25.3719	10.2927	6646.0274	4.0494	7.0919	0.0000	hypura 4096 combo prompt stable
20260402T215146Z-hypura-4096-combo-prompt-stable	2026-04-02T21:51:46.761848+00:00	hypura	discard	13.6657	13.6657	8.6234	7958.7180	4.2086	6.8267	0.0000	hypura 4096 combo prompt stable
20260402T215419Z-hypura-4096-tb13-override-probe	2026-04-02T21:54:19.375781+00:00	hypura	discard	36.6933	36.6933	17.5217	3908.1657	7.1083	7.1665	0.0000	hypura 4096 tb13 override probe
20260402T215719Z-hypura-4096-combo-prompt-stable-	2026-04-02T21:57:19.965071+00:00	hypura	discard	36.1443	36.1443	20.5807	3331.7294	9.2178	7.1399	0.0000	hypura 4096 combo prompt stable [threads_batch=13]
20260402T215755Z-hypura-4096-combo-prompt-stable-	2026-04-02T21:57:55.973648+00:00	hypura	discard	10.8556	10.8556	5.8898	11637.4386	4.2504	6.8876	0.0000	hypura 4096 combo prompt stable [threads_batch=14]
20260402T215849Z-hypura-4096-combo-prompt-stable-	2026-04-02T21:58:49.905056+00:00	hypura	discard	16.9975	16.9975	5.7229	11940.9101	6.7997	6.9600	0.0000	hypura 4096 combo prompt stable [threads_batch=15]
20260402T220016Z-tb-verify-threads-batch-13-hypur	2026-04-02T22:00:16.295644+00:00	hypura	discard	19.8681	19.8681	12.4682	5504.1949	6.9911	6.8488	0.0000	tb-verify: threads_batch=13 :: hypura 4096 combo prompt stable
20260402T220053Z-tb-verify-threads-batch-14-hypur	2026-04-02T22:00:53.287791+00:00	hypura	reject	0.0000	0.0000	0.0000	0.0000	0.0000	3.4748	0.4450	tb-verify: threads_batch=14 :: hypura 4096 combo prompt stable
20260402T220217Z-tb-verify-threads-batch-13-hypur	2026-04-02T22:02:17.725279+00:00	hypura	discard	46.4237	46.4237	35.0667	1960.7004	6.4678	7.4709	0.0000	tb-verify: threads_batch=13 :: hypura 4096 combo prompt stable
20260402T220245Z-tb-verify-threads-batch-14-hypur	2026-04-02T22:02:45.353933+00:00	hypura	discard	42.4242	42.4242	19.2815	3550.2620	3.5371	7.2970	0.0000	tb-verify: threads_batch=14 :: hypura 4096 combo prompt stable
20260402T220402Z-thread-combo-threads-9-threads-b	2026-04-02T22:04:02.095076+00:00	hypura	discard	53.8872	53.8872	26.3068	2603.4377	4.0944	7.3949	0.0000	thread-combo: threads=9, threads_batch=13 :: hypura 4096 combo prompt stable
20260402T220428Z-thread-combo-threads-9-threads-b	2026-04-02T22:04:28.749890+00:00	hypura	discard	52.7031	52.7031	38.1287	1802.4067	3.2707	7.3266	0.0000	thread-combo: threads=9, threads_batch=14 :: hypura 4096 combo prompt stable
20260402T220451Z-thread-combo-threads-9-threads-b	2026-04-02T22:04:51.454405+00:00	hypura	discard	47.6387	47.6387	10.3465	6593.2446	3.4704	7.3730	0.0000	thread-combo: threads=9, threads_batch=15 :: hypura 4096 combo prompt stable
20260402T220539Z-thread-combo-threads-10-threads-	2026-04-02T22:05:39.894223+00:00	hypura	discard	48.0175	48.0175	29.5370	2323.0239	4.4503	7.0844	0.0000	thread-combo: threads=10, threads_batch=13 :: hypura 4096 combo prompt stable
20260402T220611Z-thread-combo-threads-10-threads-	2026-04-02T22:06:11.002572+00:00	hypura	discard	16.0698	16.0698	13.3372	5160.7619	4.0366	6.8722	0.0000	thread-combo: threads=10, threads_batch=14 :: hypura 4096 combo prompt stable
20260402T220647Z-thread-combo-threads-10-threads-	2026-04-02T22:06:47.659075+00:00	hypura	discard	52.9079	52.9079	10.0188	6806.1427	4.9890	6.8233	0.0000	thread-combo: threads=10, threads_batch=15 :: hypura 4096 combo prompt stable
20260402T220736Z-thread-combo-threads-11-threads-	2026-04-02T22:07:36.067352+00:00	hypura	discard	40.7385	40.7385	23.4806	2920.5547	4.3010	7.2584	0.0000	thread-combo: threads=11, threads_batch=13 :: hypura 4096 combo prompt stable
20260402T220803Z-thread-combo-threads-11-threads-	2026-04-02T22:08:03.471847+00:00	hypura	discard	46.6925	46.6925	47.8065	1443.8164	4.3253	7.3902	0.0000	thread-combo: threads=11, threads_batch=14 :: hypura 4096 combo prompt stable
20260402T220827Z-thread-combo-threads-11-threads-	2026-04-02T22:08:27.624351+00:00	hypura	discard	41.0973	41.0973	13.8314	4940.6779	3.3668	7.2401	0.0000	thread-combo: threads=11, threads_batch=15 :: hypura 4096 combo prompt stable
20260402T220947Z-batch-combo-batch-size-384-ubatc	2026-04-02T22:09:47.765883+00:00	hypura	discard	41.0440	41.0440	50.7811	1363.4438	4.6101	7.1660	0.0000	batch-combo: batch_size=384, ubatch_size=192 :: hypura 4096 combo prompt stable
20260402T221012Z-batch-combo-batch-size-384-ubatc	2026-04-02T22:10:12.265207+00:00	hypura	discard	54.9538	54.9538	29.0965	2355.2496	5.5772	7.1383	0.0000	batch-combo: batch_size=384, ubatch_size=256 :: hypura 4096 combo prompt stable
20260402T221040Z-batch-combo-batch-size-384-ubatc	2026-04-02T22:10:40.367527+00:00	hypura	discard	51.5546	51.5546	22.6144	3026.3315	4.1175	7.0250	0.0000	batch-combo: batch_size=384, ubatch_size=320 :: hypura 4096 combo prompt stable
20260402T221106Z-batch-combo-batch-size-512-ubatc	2026-04-02T22:11:06.427746+00:00	hypura	discard	44.5160	44.5160	17.3809	3934.7944	4.0517	7.1125	0.0000	batch-combo: batch_size=512, ubatch_size=192 :: hypura 4096 combo prompt stable
20260402T221138Z-batch-combo-batch-size-512-ubatc	2026-04-02T22:11:38.302239+00:00	hypura	discard	13.1478	13.1478	8.3641	8206.0912	4.0445	6.4037	0.0000	batch-combo: batch_size=512, ubatch_size=256 :: hypura 4096 combo prompt stable
20260402T221229Z-batch-combo-batch-size-512-ubatc	2026-04-02T22:12:29.172846+00:00	hypura	discard	15.5347	15.5347	6.4460	10613.4990	6.0140	6.3963	0.0000	batch-combo: batch_size=512, ubatch_size=320 :: hypura 4096 combo prompt stable
20260402T221323Z-batch-combo-batch-size-640-ubatc	2026-04-02T22:13:23.858242+00:00	hypura	discard	12.4563	12.4563	15.7372	4401.2403	5.3749	6.4926	0.0000	batch-combo: batch_size=640, ubatch_size=192 :: hypura 4096 combo prompt stable
20260402T221400Z-batch-combo-batch-size-640-ubatc	2026-04-02T22:14:00.530099+00:00	hypura	discard	17.3722	17.3722	6.2581	10923.4440	5.0493	6.4326	0.0000	batch-combo: batch_size=640, ubatch_size=256 :: hypura 4096 combo prompt stable
20260402T221442Z-batch-combo-batch-size-640-ubatc	2026-04-02T22:14:42.005229+00:00	hypura	discard	12.1671	12.1671	6.7230	10196.7494	5.0746	6.3044	0.0000	batch-combo: batch_size=640, ubatch_size=320 :: hypura 4096 combo prompt stable
20260402T221628Z-batch-compare-b384-u256-stable	2026-04-02T22:16:28.917296+00:00	hypura	discard	32.4167	32.4167	19.8076	3451.4002	5.6083	6.6957	0.0000	batch-compare: b384 u256 stable
20260402T221731Z-batch-compare-b512-u256-stable	2026-04-02T22:17:31.473595+00:00	hypura	discard	53.8085	53.8085	29.7812	2301.9062	5.5693	6.9718	0.0000	batch-compare: b512 u256 stable
20260402T222000Z-tb-repeat-threads-batch-13-repea	2026-04-02T22:20:00.594885+00:00	hypura	discard	36.2051	36.2051	12.5689	5437.7873	5.8636	6.7656	0.0000	tb-repeat: threads_batch=13, repeat=1 :: hypura 4096 combo prompt stable
20260402T222033Z-tb-repeat-threads-batch-14-repea	2026-04-02T22:20:33.768686+00:00	hypura	discard	45.0549	45.0549	13.5678	5034.0596	4.6521	6.8052	0.0000	tb-repeat: threads_batch=14, repeat=1 :: hypura 4096 combo prompt stable
20260402T222104Z-tb-repeat-threads-batch-13-repea	2026-04-02T22:21:04.645216+00:00	hypura	discard	38.9901	38.9901	13.5869	5030.4578	4.0624	6.8400	0.0000	tb-repeat: threads_batch=13, repeat=2 :: hypura 4096 combo prompt stable
20260402T222134Z-tb-repeat-threads-batch-14-repea	2026-04-02T22:21:34.693133+00:00	hypura	discard	18.0055	18.0055	9.2676	7392.9591	4.0269	6.7959	0.0000	tb-repeat: threads_batch=14, repeat=2 :: hypura 4096 combo prompt stable
20260402T222235Z-tb-current-state-tb13-stable	2026-04-02T22:22:35.512097+00:00	hypura	discard	40.1582	40.1582	37.6783	1829.6523	4.3953	6.7785	0.0000	tb-current-state: tb13 stable
20260402T222321Z-tb-current-state-tb14-stable	2026-04-02T22:23:21.807234+00:00	hypura	discard	13.9396	13.9396	6.7147	10198.6993	5.9129	6.4877	0.0000	tb-current-state: tb14 stable
20260402T222825Z-current-state-threads-batch-13-r	2026-04-02T22:28:25.248411+00:00	hypura	discard	9.3145	9.3145	7.4675	9213.4642	8.0478	6.3618	0.0000	current-state: threads_batch=13, repeat=1 :: hypura 4096 combo prompt stable
20260402T222915Z-current-state-threads-batch-14-r	2026-04-02T22:29:15.681409+00:00	hypura	discard	9.2968	9.2968	4.1694	16416.6871	6.1486	6.1395	0.0000	current-state: threads_batch=14, repeat=1 :: hypura 4096 combo prompt stable
20260402T223011Z-current-state-threads-batch-13-r	2026-04-02T22:30:11.979776+00:00	hypura	discard	10.2548	10.2548	8.5403	8059.7838	5.3903	6.0608	0.0003	current-state: threads_batch=13, repeat=2 :: hypura 4096 combo prompt stable
20260402T223056Z-current-state-threads-batch-14-r	2026-04-02T22:30:56.063221+00:00	hypura	discard	11.3664	11.3664	8.4693	8116.9891	6.1011	5.9869	0.0000	current-state: threads_batch=14, repeat=2 :: hypura 4096 combo prompt stable
20260402T223314Z-current-state-threads-batch-13-r	2026-04-02T22:33:14.014745+00:00	hypura	reject	0.0000	0.0000	0.0000	0.0000	0.0000	3.6313	0.6012	current-state: threads_batch=13, repeat=1 :: hypura 4096 combo prompt stable
20260402T223326Z-current-state-threads-batch-14-r	2026-04-02T22:33:26.294745+00:00	hypura	reject	0.0000	0.0000	0.0000	0.0000	0.0000	3.8200	0.4796	current-state: threads_batch=14, repeat=1 :: hypura 4096 combo prompt stable
20260402T223336Z-current-state-threads-batch-13-r	2026-04-02T22:33:36.763130+00:00	hypura	reject	0.0000	0.0000	0.0000	0.0000	0.0000	3.9905	0.3377	current-state: threads_batch=13, repeat=2 :: hypura 4096 combo prompt stable
20260402T223346Z-current-state-threads-batch-14-r	2026-04-02T22:33:46.789287+00:00	hypura	reject	0.0000	0.0000	0.0000	0.0000	0.0000	4.1458	0.2660	current-state: threads_batch=14, repeat=2 :: hypura 4096 combo prompt stable
20260402T223510Z-current-state-threads-batch-13-r	2026-04-02T22:35:10.552290+00:00	hypura	discard	12.7017	12.7017	20.9050	3331.5363	5.9511	6.8628	0.0000	current-state: threads_batch=13, repeat=1 :: hypura 4096 combo prompt stable
20260402T223545Z-current-state-threads-batch-14-r	2026-04-02T22:35:45.666858+00:00	hypura	discard	30.8488	30.8488	14.5582	4703.3381	5.5590	6.8334	0.0000	current-state: threads_batch=14, repeat=1 :: hypura 4096 combo prompt stable
20260402T223618Z-current-state-threads-batch-13-r	2026-04-02T22:36:18.322660+00:00	hypura	discard	15.1386	15.1386	10.4301	6585.6583	4.6909	6.8890	0.0000	current-state: threads_batch=13, repeat=2 :: hypura 4096 combo prompt stable
20260402T223655Z-current-state-threads-batch-14-r	2026-04-02T22:36:55.134305+00:00	hypura	discard	46.2102	46.2102	14.2833	4782.4384	5.3807	7.0082	0.0000	current-state: threads_batch=14, repeat=2 :: hypura 4096 combo prompt stable
20260402T224621Z-current-state-threads-batch-13-h	2026-04-02T22:46:21.199168+00:00	hypura	discard	16.2701	16.2701	7.4974	9131.2509	9.1457	6.5965	0.0000	current-state: threads_batch=13 :: hypura 4096 combo prompt stable
20260402T224707Z-current-state-threads-batch-14-h	2026-04-02T22:47:07.553331+00:00	hypura	discard	17.0992	17.0992	11.2836	6084.9274	5.6089	6.6686	0.0000	current-state: threads_batch=14 :: hypura 4096 combo prompt stable
20260402T225231Z-current-state-threads-batch-13-h	2026-04-02T22:52:31.521508+00:00	hypura	discard	43.6600	43.6600	16.1019	4246.0191	7.5353	6.8361	0.0000	current-state: threads_batch=13 :: hypura 4096 combo prompt stable
20260402T225305Z-current-state-threads-batch-14-h	2026-04-02T22:53:05.856087+00:00	hypura	discard	20.8480	20.8480	14.0233	4897.0280	4.6895	6.8421	0.0000	current-state: threads_batch=14 :: hypura 4096 combo prompt stable
20260402T225434Z-current-state-threads-batch-13-h	2026-04-02T22:54:34.999410+00:00	hypura	reject	0.0000	0.0000	0.0000	0.0000	0.0000	3.5290	0.7023	current-state: threads_batch=13 :: hypura 4096 combo prompt stable
20260402T225445Z-current-state-threads-batch-14-h	2026-04-02T22:54:45.400574+00:00	hypura	reject	0.0000	0.0000	0.0000	0.0000	0.0000	3.3895	0.4387	current-state: threads_batch=14 :: hypura 4096 combo prompt stable
20260402T230016Z-current-state-threads-batch-13-h	2026-04-02T23:00:16.683898+00:00	hypura	discard	54.1205	54.1205	62.5890	1104.9294	7.0279	9.3211	0.0000	current-state: threads_batch=13 :: hypura 4096 combo prompt stable
20260402T230041Z-current-state-threads-batch-14-h	2026-04-02T23:00:41.254754+00:00	hypura	discard	54.6866	54.6866	63.0495	1096.8044	1.7862	10.8488	0.0000	current-state: threads_batch=14 :: hypura 4096 combo prompt stable
20260402T233538Z-flashmoe-slot-bank-16-smoke	2026-04-02T23:35:38.660136+00:00	flashmoe	crash	0.0000	0.0000	0.0000	0.0000	0.0000	10.6420	0.0000	flashmoe slot-bank 16 smoke
20260402T233718Z-flashmoe-slot-bank-16-smoke	2026-04-02T23:37:18.869442+00:00	flashmoe	discard	12.2000	12.2000	7.6000	81.9672	21.5222	8.2795	0.0000	flashmoe slot-bank 16 smoke
20260402T233900Z-flashmoe-bank-ngl-moe-slot-bank-	2026-04-02T23:39:00.897109+00:00	flashmoe	discard	12.9000	12.9000	8.9000	77.5194	19.8476	9.3899	0.0000	flashmoe-bank-ngl: moe_slot_bank=8, gpu_layers=0 :: flashmoe slot-bank 16 ngl99
20260402T234011Z-flashmoe-bank-ngl-moe-slot-bank-	2026-04-02T23:40:11.500994+00:00	flashmoe	discard	10.6000	10.6000	7.1000	94.3396	21.3133	11.0452	0.0000	flashmoe-bank-ngl: moe_slot_bank=8, gpu_layers=99 :: flashmoe slot-bank 16 ngl99
20260402T234127Z-flashmoe-bank-ngl-moe-slot-bank-	2026-04-02T23:41:27.161332+00:00	flashmoe	discard	14.6000	14.6000	11.4000	68.4932	18.0281	9.4071	0.0141	flashmoe-bank-ngl: moe_slot_bank=16, gpu_layers=0 :: flashmoe slot-bank 16 ngl99
20260402T234234Z-flashmoe-bank-ngl-moe-slot-bank-	2026-04-02T23:42:34.519499+00:00	flashmoe	discard	13.1000	13.1000	8.1000	76.3359	20.5139	8.7873	0.2232	flashmoe-bank-ngl: moe_slot_bank=16, gpu_layers=99 :: flashmoe slot-bank 16 ngl99
