run_id	time	backend	status	score	gen_tok_s	prompt_tok_s	ttft_ms	load_s	min_free_gb	swap_delta_gb	description
20260402T234400Z-flashmoe-slot-bank-16-cpu-dense-	2026-04-02T23:44:00.797719+00:00	flashmoe	discard	13.9000	13.9000	10.9000	71.9424	18.6859	8.8095	0.0000	flashmoe slot-bank 16 cpu dense stable
20260402T235954Z-flashmoe-threads-threads-8-threa	2026-04-02T23:59:54.700166+00:00	flashmoe	discard	14.8000	14.8000	10.5000	67.5676	17.9479	9.6859	0.0000	flashmoe-threads: threads=8, threads_batch=8 :: flashmoe slot-bank 16 cpu dense stable
20260403T000102Z-flashmoe-threads-threads-8-threa	2026-04-03T00:01:02.867156+00:00	flashmoe	discard	14.7000	14.7000	10.3000	68.0272	18.9169	9.6562	0.0000	flashmoe-threads: threads=8, threads_batch=10 :: flashmoe slot-bank 16 cpu dense stable
20260403T000246Z-current-state-threads-batch-13-r	2026-04-03T00:02:46.164206+00:00	hypura	discard	52.6254	52.6254	63.5221	1089.4964	7.9628	8.9963	0.0038	current-state: threads_batch=13, repeat=1 :: hypura 4096 combo prompt stable
20260403T000307Z-current-state-threads-batch-14-r	2026-04-03T00:03:07.270235+00:00	hypura	discard	54.3296	54.3296	62.4534	1107.2183	2.7472	8.9504	0.0000	current-state: threads_batch=14, repeat=1 :: hypura 4096 combo prompt stable
20260403T000319Z-current-state-threads-batch-13-r	2026-04-03T00:03:19.852205+00:00	hypura	discard	53.8977	53.8977	63.1046	1096.1301	1.7393	9.3060	0.0000	current-state: threads_batch=13, repeat=2 :: hypura 4096 combo prompt stable
20260403T000331Z-current-state-threads-batch-14-r	2026-04-03T00:03:31.935982+00:00	hypura	discard	45.4551	45.4551	25.2886	2710.9611	2.0121	8.9576	0.0000	current-state: threads_batch=14, repeat=2 :: hypura 4096 combo prompt stable
20260403T000352Z-flashmoe-slot-bank-16-cpu-dense-	2026-04-03T00:03:52.883167+00:00	flashmoe	discard	14.9000	14.9000	10.5000	67.1141	17.0616	10.5600	0.0004	flashmoe slot-bank 16 cpu dense t8 stable
20260403T000936Z-current-state-threads-batch-13-h	2026-04-03T00:09:36.432246+00:00	hypura	discard	54.2858	54.2858	66.0887	1047.3407	5.8896	9.0552	0.0000	current-state: threads_batch=13 :: hypura 4096 combo prompt stable
20260403T001319Z-flashmoe-batch-batch-size-1-ubat	2026-04-03T00:13:19.923013+00:00	flashmoe	discard	14.8000	14.8000	10.6000	67.5676	17.9394	9.9729	0.0000	flashmoe-batch: batch_size=1, ubatch_size=1 :: flashmoe slot-bank 16 cpu dense t8 stable
20260403T001423Z-flashmoe-batch-batch-size-1-ubat	2026-04-03T00:14:23.307955+00:00	flashmoe	discard	14.9000	14.9000	10.4000	67.1141	18.4813	10.0766	0.0000	flashmoe-batch: batch_size=1, ubatch_size=2 :: flashmoe slot-bank 16 cpu dense t8 stable
20260403T001529Z-flashmoe-batch-batch-size-1-ubat	2026-04-03T00:15:29.397558+00:00	flashmoe	discard	14.7000	14.7000	10.4000	68.0272	17.9666	10.1201	0.0000	flashmoe-batch: batch_size=1, ubatch_size=4 :: flashmoe slot-bank 16 cpu dense t8 stable
20260403T001637Z-flashmoe-batch-batch-size-2-ubat	2026-04-03T00:16:37.237239+00:00	flashmoe	discard	14.6000	14.6000	11.1000	68.4932	18.8632	9.8858	0.0000	flashmoe-batch: batch_size=2, ubatch_size=1 :: flashmoe slot-bank 16 cpu dense t8 stable
20260403T001746Z-flashmoe-batch-batch-size-2-ubat	2026-04-03T00:17:46.280542+00:00	flashmoe	discard	15.1000	15.1000	11.9000	66.2252	18.5021	9.8955	0.0000	flashmoe-batch: batch_size=2, ubatch_size=2 :: flashmoe slot-bank 16 cpu dense t8 stable
20260403T003947Z-flashmoe-server-slot-bank-16-cpu	2026-04-03T00:39:47.651837+00:00	flashmoe_server	discard	18.7664	18.7664	22.6880	3006.3847	9.2703	10.7132	0.0000	flashmoe server slot-bank 16 cpu dense stable
20260403T004039Z-flashmoe-server-slot-bank-16-cpu	2026-04-03T00:40:39.294024+00:00	flashmoe_server	discard	19.1107	19.1107	22.3626	3048.1582	9.1907	10.7039	0.0000	flashmoe server slot-bank 16 cpu dense stable
20260403T004317Z-flashmoe-server-ctx-threads-cont	2026-04-03T00:43:17.729702+00:00	flashmoe_server	discard	18.6204	18.6204	22.3943	3045.5335	9.7007	10.5742	0.0000	flashmoe-server-ctx-threads: context=2048, threads=8, threads_batch=8 :: flashmoe server slot-bank 16 cpu dense stable
20260403T004423Z-flashmoe-server-probe-ctx-2048-t	2026-04-03T00:44:23.437923+00:00	flashmoe_server	discard	18.3109	18.3109	22.0322	3095.6122	9.4008	10.5477	0.0000	flashmoe_server probe ctx=2048 t=8
20260403T004508Z-flashmoe-server-probe-ctx-2048-t	2026-04-03T00:45:08.321278+00:00	flashmoe_server	discard	17.3167	17.3167	20.0460	3400.0669	9.5309	9.8784	0.0000	flashmoe_server probe ctx=2048 t=10
20260403T004553Z-flashmoe-server-probe-ctx-2048-t	2026-04-03T00:45:53.586773+00:00	flashmoe_server	discard	15.6429	15.6429	16.5278	4117.6996	9.2040	9.7359	0.0000	flashmoe_server probe ctx=2048 t=12
20260403T004758Z-flashmoe-server-targeted-ctx-307	2026-04-03T00:47:58.923756+00:00	flashmoe_server	discard	16.3727	16.3727	17.5710	3874.1784	9.8345	9.7623	0.0000	flashmoe_server targeted ctx=3072 t=8
20260403T004845Z-flashmoe-server-targeted-ctx-409	2026-04-03T00:48:45.755736+00:00	flashmoe_server	discard	16.3732	16.3732	17.4440	3901.9323	9.3267	9.7463	0.0000	flashmoe_server targeted ctx=4096 t=8
20260403T005004Z-flashmoe-server-tb-probe-t-10-tb	2026-04-03T00:50:04.425741+00:00	flashmoe_server	discard	16.0325	16.0325	17.5184	3886.9243	10.1379	9.5905	0.0000	flashmoe_server tb probe t=10 tb=8
